movie_id,review_id,review_title,text,date,rating,positive_votes,negative_votes,scrapping_timestamp
6208148,10389367,Poisoned apples all round.,"As always, whenever there's a negative hype around a movie, my mindset is always, prove them wrong, give it a chance.

It's diabolical, honestly, I can't understand how so much money and so much time has gone into this, the final result is cringe worthy. It is an absolute shocker, I am stumped to find any positives.

It looks and feels so artificial, the sets, the animals, as for The Dwarves themselves, I have no words to express my feelings there.

The biggest catastrophe, not what I was expecting if I'm honest, the worst offender, Gal Gadot, she looks sensational, but her performance, she's going to scoop some unwanted awards it's fair to say.

What I wasn't expecting, was just how poor the costumes would look on screen, Snow White's just doesn't translate very well, the hairstyle, what were they thinking?

Disney, what on Earth have you done?",20 March 2025,1,5210,348,2025-03-20 12:00:00
6208148,10392322,Rooting for the Apple,"Disney's live-action Snow White is finally here, and after watching it, I can confidently say that the Magic Mirror needs a new prescription. This movie is less ""fairest of them all"" and more ""fairest at failing upwards."" If you ever wondered what it would look like if someone took the classic 1937 animated masterpiece, ran it through a corporate buzzword generator, and then tossed in some awkward CGI for good measure-congratulations, you've found your answer!

A Princess with a Personality (Kind Of?)

Rachel Zegler takes on the role of Snow White, though you'd be forgiven for thinking she was actually playing a medieval TED Talk speaker. Instead of the wide-eyed, kind-hearted princess we all knew, this Snow White is a Strong Independent Woman™-because saying ""I want to be a queen, not a bride"" apparently counts as character development these days. That's right, folks, forget charming dwarfs, woodland creatures, or actual chemistry with anyone; this Snow White has dreams, and she's here to remind you about them every five minutes.

But despite all that, her biggest challenge in the movie isn't even the Evil Queen-it's keeping the audience awake.

Gal Gadot: Evil Queen or Instagram Influencer?

Now, let's talk about Gal Gadot's Evil Queen. You'd think that playing a narcissistic, beauty-obsessed villain would be an easy fit for Hollywood, but somehow, even with all the pouting, dress-swishing, and over-the-top glowering, she ends up about as menacing as a fashion blogger with a bad attitude.

Her obsession with being ""the fairest of them all"" is laughable when you realize that, well... she already is the fairest of them all. No offense to Snow White, but if the mirror told me that Gal Gadot wasn't the hottest person in the kingdom, I'd be smashing that thing to pieces too. The real villain here is the mirror's manufacturer.

The Dwarfs: Now with 90% Less Dwarfs!

Ah yes, the seven dwarfs-except, surprise! They're not really dwarfs anymore. Instead, we get a diverse group of CGI-enhanced ""magical creatures"" who look like they were rejected from The Lord of the Rings for being too unsettling. Imagine if a bunch of carnival performers got stuck in a blender with bad CGI, and you've got these guys.

Their role in the movie? Mostly to exist, deliver unfunny one-liners, and make you wonder if we should start a petition to bring back actual actors instead of whatever motion-capture madness this is. If I wanted to spend two hours looking at weirdly animated characters, I'd just play a bad video game.

The Apple Fiasco

We all know the story: Evil Queen poisons apple, Snow White eats apple, Snow White falls into a death nap, and then a prince shows up to wake her with true love's kiss. Simple, right? Nope. Not in this version.

Instead, we get a long, drawn-out scene where Snow White almost eats the apple, but then stops to give another speech about believing in yourself or some nonsense. And when she does finally bite it, the whole moment is ruined by some weird slow-motion effects that make it look like an overly dramatic shampoo commercial.

Honestly, I was rooting for the apple at that point. Maybe if she stayed in an enchanted coma, we'd all be spared another unnecessary Disney remake.

Final Verdict: The Fairest Disaster of Them All

This movie is what happens when you take a beloved classic, strip away everything that made it charming, and replace it with corporate-approved ""modernization"" that pleases no one. It's a film that wants to be empowering, but instead feels like a checklist of forced inclusivity and soulless spectacle.

Snow White (2025) is proof that sometimes, it's better to leave well enough alone. If you're looking for magic, wonder, and nostalgia, just rewatch the 1937 version. If you're looking for two hours of your life you'll never get back, then by all means, go ahead and buy a ticket.",20 March 2025,1,2863,741,2025-03-20 12:00:00
6208148,10388881,"Disney's Snow White (2025) - A Hollow, Uninspired Reimagining","Disney's latest live-action remake, Snow White (2025), is yet another attempt to cash in on nostalgia, but unfortunately, it falls flat in almost every regard. From lackluster performances to subpar CGI, this film struggles to capture the magic of the original classic.

Rachel Zegler: A Miscast Lead

Rachel Zegler, who takes on the iconic role of Snow White, delivers a performance that feels stiff and uninspired. While she undeniably has a strong singing voice, her acting lacks the warmth and charm that made the animated Snow White so beloved. Her line delivery often comes off as forced, and she struggles to bring emotional depth to the character. Instead of exuding the innocence and kindness associated with Snow White, her portrayal feels distant and, at times, even disengaged.

Weak CGI and Bland Visuals

For a film with Disney's budget, the CGI is shockingly subpar. The enchanted forest, which should have felt lush and immersive, looks artificial, and the CGI creatures lack the expressiveness and charm of their animated counterparts. The dwarfs-who have been controversially reimagined-look awkward and unnatural, making it hard to emotionally invest in their presence. The visual effects in Snow White feel rushed, and instead of enhancing the experience, they serve as a constant distraction.

Music: Strong Vocals, Forgettable Songs

If there's one aspect where the film slightly shines, it's Zegler's singing. She undeniably has a beautiful voice, and her vocal performances are solid. However, the new songs she's given are bland and unmemorable, failing to capture the whimsy and timeless appeal of the original soundtrack. Unlike Beauty and the Beast or The Little Mermaid, which at least had a few standout musical moments, Snow White's soundtrack feels generic and uninspired.

Conclusion: A Missed Opportunity

Ultimately, Snow White is another soulless live-action remake that lacks the heart and magic of the original. While Zegler's singing is a bright spot, her acting, coupled with bad CGI and uninspired musical numbers, makes this adaptation feel unnecessary. Disney had an opportunity to bring a fresh and captivating take on Snow White, but instead, they delivered a forgettable and lackluster film. Fans of the original will likely leave disappointed, longing for the charm and artistry that made the 1937 classic a masterpiece.
",20 March 2025,1,3724,303,2025-03-20 12:00:00
